{
  "schema": "castalia.castaway-contents.v2-draft",
  "version": 2,
  "ownerMemberKey": "d75a980182b10ab7d54bfed3c964073a0ee172f3daa62325af021a68f707511a",
  "entries": [
    {
      "entryId": "example-account-description",
      "publication": {
        "id": "https://example.org/castalia/example-connection/profile",
        "version": "1.0.0",
        "sha256": "dc6a6a7d0e0379a75c1b87a51c63945c01bd1c27a2047fb39e7d85869f92e311"
      },
      "partId": "account",
      "value": {
        "schema": "org.example.connection-account.v1",
        "accountId": "example-account",
        "serviceOrigin": "https://service.example.org",
        "userId": "alice"
      }
    }
  ]
}
